{
  "schema_version": "1.0",
  "filter_id": "experimental.bloom",
  "filter_version": "1.0.0",
  "family_id": "experimental",
  "created_at": "2026-07-13T00:00:00Z",
  "input_media_roles": {"film": "choose-a-film.mp4"},
  "parameters": {"starting_intensity": 0.05, "ending_intensity": 0.95, "curve_shape": "Gentle nonlinear", "bloom_dimensions": "Dialogue + Time + mild Identity", "maximum_identity_instability": 0.4, "maximum_temporal_distance": 1200.0, "preserve_ending_coherence": true},
  "output_settings": {"form": "best_short"},
  "random_seed": 1,
  "target_duration": 180.0,
  "progression_settings": {"curve_shape": "Gentle nonlinear", "starting_intensity": 0.05, "ending_intensity": 0.95},
  "identity_mapping_settings": {},
  "selected_filter_stack": ["experimental.bloom"],
  "compatibility_decisions": [],
  "requested_analysis_backends": {"diarization": "pyannote", "transcription": "small"},
  "actual_analysis_backends": {}
}
