{
  "schema_version": "1.0",
  "filter_id": "identity.possession",
  "filter_version": "1.0.0",
  "family_id": "identity",
  "created_at": "2026-07-13T00:00:00Z",
  "input_media_roles": {"film": "choose-a-film.mp4"},
  "parameters": {"possessing_speaker": "auto", "possessed_speaker": "auto", "intensity": "Moderate", "identity_stability": "Strict", "minimum_temporal_separation": 20.0, "performance_preservation": "Similar performance", "allow_line_reuse": false, "replace_scope": "All appearances"},
  "output_settings": {"form": "full_length"},
  "random_seed": 1,
  "target_duration": null,
  "progression_settings": {},
  "identity_mapping_settings": {"possessing_speaker": "auto", "possessed_speaker": "auto", "identity_stability": "Strict"},
  "selected_filter_stack": ["identity.possession"],
  "compatibility_decisions": [],
  "requested_analysis_backends": {"diarization": "pyannote", "transcription": "small"},
  "actual_analysis_backends": {}
}
